nazev,popis,kategorie,obrazek
Starověký Egypt,Objevujte tajemství faraonů a mumifikace.,Historie,egypt.jpg
Prehistorické dinosauři,Giganti z dávných dob kteří fascinují děti i dospělé.,Příroda,dinosauri.jpg
Moderní umění,Významní malíři a současní umělci světa.,Umění,moderni.jpg
Středověké zbraně,Poznejte historii rytířů a středověkých bitev.,Historie,stredoveke.jpg
Vesmír a astronomie,Expozice plná planet hvězd a vesmírných misí.,Věda,vesmir.jpg
Historie hudby,Od středověkých nástrojů po moderní hudební technologie.,Kultura,hudba.jpg